,0,1,2
mirna_FickS: Fickett score,tensor(0.0036),FickS: Fickett score,tensor(0.0036)
mirna_SCCou: Stop codon count,tensor(0.0023),SCCou: Stop codon count,tensor(0.0023)
mirna_SCFre: Stop codon frequency,tensor(0.0019),SCFre: Stop codon frequency,tensor(0.0019)
mirna_SCCFS: Stop codon count frame score,tensor(0.0005),SCCFS: Stop codon count frame score,tensor(0.0005)
mirna_SCFFS: Stop codon frequency frame score,tensor(0.0005),SCFFS: Stop codon frequency frame score,tensor(0.0005)
mirna_LORFL: Longest ORF length,tensor(-0.0011),LORFL: Longest ORF length,tensor(-0.0011)
mirna_ORFCo: ORF coverage,tensor(-0.0005),ORFCo: ORF coverage,tensor(-0.0005)
mirna_ORFIn: ORF integrity,tensor(0.0005),ORFIn: ORF integrity,tensor(0.0005)
mirna_ORFFS: ORF frame score,tensor(-5.9992e-05),ORFFS: ORF frame score,tensor(-5.9992e-05)
mirna_ORFEA: Entropy density A on ORF,tensor(-1.6361e-05),ORFEA: Entropy density A on ORF,tensor(-1.6361e-05)
mirna_ORFEC: Entropy density C on ORF,tensor(2.5764e-05),ORFEC: Entropy density C on ORF,tensor(2.5764e-05)
mirna_ORFED: Entropy density D on ORF,tensor(-0.0001),ORFED: Entropy density D on ORF,tensor(-0.0001)
mirna_ORFEE: Entropy density E on ORF,tensor(0.0002),ORFEE: Entropy density E on ORF,tensor(0.0002)
mirna_ORFEF: Entropy density F on ORF,tensor(0.0004),ORFEF: Entropy density F on ORF,tensor(0.0004)
mirna_ORFEG: Entropy density G on ORF,tensor(0.0003),ORFEG: Entropy density G on ORF,tensor(0.0003)
mirna_ORFEH: Entropy density H on ORF,tensor(-8.8751e-05),ORFEH: Entropy density H on ORF,tensor(-8.8751e-05)
mirna_ORFEI: Entropy density I on ORF,tensor(0.0002),ORFEI: Entropy density I on ORF,tensor(0.0002)
mirna_ORFEK: Entropy density K on ORF,tensor(-0.0002),ORFEK: Entropy density K on ORF,tensor(-0.0002)
mirna_ORFEL: Entropy density L on ORF,tensor(-0.0003),ORFEL: Entropy density L on ORF,tensor(-0.0003)
mirna_ORFEM: Entropy density M on ORF,tensor(-0.0018),ORFEM: Entropy density M on ORF,tensor(-0.0018)
mirna_ORFEN: Entropy density N on ORF,tensor(-0.0004),ORFEN: Entropy density N on ORF,tensor(-0.0004)
mirna_ORFEP: Entropy density P on ORF,tensor(-4.9338e-05),ORFEP: Entropy density P on ORF,tensor(-4.9338e-05)
mirna_ORFEQ: Entropy density Q on ORF,tensor(-0.0006),ORFEQ: Entropy density Q on ORF,tensor(-0.0006)
mirna_ORFER: Entropy density R on ORF,tensor(0.0002),ORFER: Entropy density R on ORF,tensor(0.0002)
mirna_ORFES: Entropy density S on ORF,tensor(0.0001),ORFES: Entropy density S on ORF,tensor(0.0001)
mirna_ORFET: Entropy density T on ORF,tensor(-0.0002),ORFET: Entropy density T on ORF,tensor(-0.0002)
mirna_ORFEV: Entropy density V on ORF,tensor(-0.0002),ORFEV: Entropy density V on ORF,tensor(-0.0002)
mirna_ORFEW: Entropy density W on ORF,tensor(-0.0001),ORFEW: Entropy density W on ORF,tensor(-0.0001)
mirna_ORFEY: Entropy density Y on ORF,tensor(-0.0001),ORFEY: Entropy density Y on ORF,tensor(-0.0001)
mirna_EucDist.LNC_orf,tensor(-0.0012),EucDist.LNC_orf,tensor(-0.0012)
mirna_EucDist.PCT_orf,tensor(-0.0012),EucDist.PCT_orf,tensor(-0.0012)
mirna_EucDist.Ratio_orf,tensor(-0.0014),EucDist.Ratio_orf,tensor(-0.0014)
mirna_LogDist.LNC_orf,tensor(0.0075),LogDist.LNC_orf,tensor(0.0075)
mirna_LogDist.PCT_orf,tensor(0.0049),LogDist.PCT_orf,tensor(0.0049)
mirna_LogDist.Ratio_orf,tensor(-0.0012),LogDist.Ratio_orf,tensor(-0.0012)
mirna_Hexamer.Score_orf,tensor(-3.9041e-06),Hexamer.Score_orf,tensor(-3.9041e-06)
mirna_GCCoW: GC content of whole sequence,tensor(0.0015),GCCoW: GC content of whole sequence,tensor(0.0015)
mirna_GCCo1: GC content of 1st position of codons,tensor(0.0052),GCCo1: GC content of 1st position of codons,tensor(0.0052)
mirna_GCCo2: GC content of 2nd position of codons,tensor(0.0029),GCCo2: GC content of 2nd position of codons,tensor(0.0029)
mirna_GCCo3: GC content of 3rd position of codons,tensor(0.0071),GCCo3: GC content of 3rd position of codons,tensor(0.0071)
mirna_GCC1V: GCCo1 variance frame score,tensor(0.0030),GCC1V: GCCo1 variance frame score,tensor(0.0030)
mirna_GCC2V: GCCo2 variance frame score,tensor(0.0044),GCC2V: GCCo2 variance frame score,tensor(0.0044)
mirna_GCC3V: GCCo3 variance frame score,tensor(0.0035),GCC3V: GCCo3 variance frame score,tensor(0.0035)
mirna_TraHS: Hexamer score on transcript,tensor(-3.9041e-06),TraHS: Hexamer score on transcript,tensor(-3.9041e-06)
mirna_TrLen: Transcript length,tensor(0.0068),TrLen: Transcript length,tensor(0.0068)
mirna_L5UTR: Length of 5 untranslated region,tensor(0.0003),L5UTR: Length of 5 untranslated region,tensor(0.0003)
mirna_L3UTR: Length of 3 untranslated region,tensor(0.0001),L3UTR: Length of 3 untranslated region,tensor(0.0001)
mirna_C5UTR: Coverage of 5 untranslated region,tensor(-0.0008),C5UTR: Coverage of 5 untranslated region,tensor(-0.0008)
mirna_C3UTR: Coverage of 3 untranslated region,tensor(1.6540e-05),C3UTR: Coverage of 3 untranslated region,tensor(1.6540e-05)
mirna_TraEA: Entropy density A on transcript,tensor(0.0004),TraEA: Entropy density A on transcript,tensor(0.0004)
mirna_TraEC: Entropy density C on transcript,tensor(0.0061),TraEC: Entropy density C on transcript,tensor(0.0061)
mirna_TraED: Entropy density D on transcript,tensor(0.0004),TraED: Entropy density D on transcript,tensor(0.0004)
mirna_TraEE: Entropy density E on transcript,tensor(0.0021),TraEE: Entropy density E on transcript,tensor(0.0021)
mirna_TraEF: Entropy density F on transcript,tensor(-0.0018),TraEF: Entropy density F on transcript,tensor(-0.0018)
mirna_TraEG: Entropy density G on transcript,tensor(0.0026),TraEG: Entropy density G on transcript,tensor(0.0026)
mirna_TraEH: Entropy density H on transcript,tensor(0.0111),TraEH: Entropy density H on transcript,tensor(0.0111)
mirna_TraEI: Entropy density I on transcript,tensor(0.0106),TraEI: Entropy density I on transcript,tensor(0.0106)
mirna_TraEK: Entropy density K on transcript,tensor(0.0044),TraEK: Entropy density K on transcript,tensor(0.0044)
mirna_TraEL: Entropy density L on transcript,tensor(-0.0026),TraEL: Entropy density L on transcript,tensor(-0.0026)
mirna_TraEM: Entropy density M on transcript,tensor(0.0015),TraEM: Entropy density M on transcript,tensor(0.0015)
mirna_TraEN: Entropy density N on transcript,tensor(0.0010),TraEN: Entropy density N on transcript,tensor(0.0010)
mirna_TraEP: Entropy density P on transcript,tensor(-0.0006),TraEP: Entropy density P on transcript,tensor(-0.0006)
mirna_TraEQ: Entropy density Q on transcript,tensor(0.0104),TraEQ: Entropy density Q on transcript,tensor(0.0104)
mirna_TraER: Entropy density R on transcript,tensor(0.0043),TraER: Entropy density R on transcript,tensor(0.0043)
mirna_TraES: Entropy density S on transcript,tensor(-0.0016),TraES: Entropy density S on transcript,tensor(-0.0016)
mirna_TraET: Entropy density T on transcript,tensor(-0.0019),TraET: Entropy density T on transcript,tensor(-0.0019)
mirna_TraEV: Entropy density V on transcript,tensor(0.0017),TraEV: Entropy density V on transcript,tensor(0.0017)
mirna_TraEW: Entropy density W on transcript,tensor(0.0010),TraEW: Entropy density W on transcript,tensor(0.0010)
mirna_TraEY: Entropy density Y on transcript,tensor(0.0009),TraEY: Entropy density Y on transcript,tensor(0.0009)
mirna_ComRA: Composition of A,tensor(0.0063),ComRA: Composition of A,tensor(0.0063)
mirna_ComRT: Composition of T,tensor(-0.0022),ComRT: Composition of T,tensor(-0.0022)
mirna_ComRG: Composition of G,tensor(0.0072),ComRG: Composition of G,tensor(0.0072)
mirna_ComRC: Composition of C,tensor(-0.0015),ComRC: Composition of C,tensor(-0.0015)
mirna_TraAT: Transition between A and T,tensor(0.0023),TraAT: Transition between A and T,tensor(0.0023)
mirna_TraAG: Transition between A and G,tensor(0.0039),TraAG: Transition between A and G,tensor(0.0039)
mirna_TraAC: Transition between A and C,tensor(0.0042),TraAC: Transition between A and C,tensor(0.0042)
mirna_TraTG: Transition between T and G,tensor(0.0060),TraTG: Transition between T and G,tensor(0.0060)
mirna_TraTC: Transition between T and C,tensor(-0.0036),TraTC: Transition between T and C,tensor(-0.0036)
mirna_TraGC: Transition between G and C,tensor(0.0081),TraGC: Transition between G and C,tensor(0.0081)
mirna_DPRA0: Distribution of 0.00A,tensor(0.0001),DPRA0: Distribution of 0.00A,tensor(0.0001)
mirna_DPRA1: Distribution of 0.25A,tensor(0.0049),DPRA1: Distribution of 0.25A,tensor(0.0049)
mirna_DPRA2: Distribution of 0.50A,tensor(0.0084),DPRA2: Distribution of 0.50A,tensor(0.0084)
mirna_DPRA3: Distribution of 0.75A,tensor(0.0051),DPRA3: Distribution of 0.75A,tensor(0.0051)
mirna_DPRA4: Distribution of 1.00A,tensor(0.0010),DPRA4: Distribution of 1.00A,tensor(0.0010)
mirna_DPRT0: Distribution of 0.00T,tensor(0.0088),DPRT0: Distribution of 0.00T,tensor(0.0088)
mirna_DPRT1: Distribution of 0.25T,tensor(0.0057),DPRT1: Distribution of 0.25T,tensor(0.0057)
mirna_DPRT2: Distribution of 0.50T,tensor(0.0098),DPRT2: Distribution of 0.50T,tensor(0.0098)
mirna_DPRT3: Distribution of 0.75T,tensor(0.0034),DPRT3: Distribution of 0.75T,tensor(0.0034)
mirna_DPRT4: Distribution of 1.00T,tensor(-0.0002),DPRT4: Distribution of 1.00T,tensor(-0.0002)
mirna_DPRG0: Distribution of 0.00G,tensor(-0.0033),DPRG0: Distribution of 0.00G,tensor(-0.0033)
mirna_DPRG1: Distribution of 0.25G,tensor(-0.0028),DPRG1: Distribution of 0.25G,tensor(-0.0028)
mirna_DPRG2: Distribution of 0.50G,tensor(0.0030),DPRG2: Distribution of 0.50G,tensor(0.0030)
mirna_DPRG3: Distribution of 0.75G,tensor(0.0035),DPRG3: Distribution of 0.75G,tensor(0.0035)
mirna_DPRG4: Distribution of 1.00G,tensor(0.0073),DPRG4: Distribution of 1.00G,tensor(0.0073)
mirna_DPRC0: Distribution of 0.00C,tensor(0.0046),DPRC0: Distribution of 0.00C,tensor(0.0046)
mirna_DPRC1: Distribution of 0.25C,tensor(-0.0003),DPRC1: Distribution of 0.25C,tensor(-0.0003)
mirna_DPRC2: Distribution of 0.50C,tensor(-0.0023),DPRC2: Distribution of 0.50C,tensor(-0.0023)
mirna_DPRC3: Distribution of 0.75C,tensor(-0.0008),DPRC3: Distribution of 0.75C,tensor(-0.0008)
mirna_DPRC4: Distribution of 1.00C,tensor(-0.0027),DPRC4: Distribution of 1.00C,tensor(-0.0027)
mirna_KMAAA: Transcript k-mer AAA content,tensor(0.0055),KMAAA: Transcript k-mer AAA content,tensor(0.0055)
mirna_KMAAG: Transcript k-mer AAG content,tensor(0.0044),KMAAG: Transcript k-mer AAG content,tensor(0.0044)
mirna_KMAAT: Transcript k-mer AAT content,tensor(0.0038),KMAAT: Transcript k-mer AAT content,tensor(0.0038)
mirna_KMAAC: Transcript k-mer AAC content,tensor(0.0032),KMAAC: Transcript k-mer AAC content,tensor(0.0032)
mirna_KMAGA: Transcript k-mer AGA content,tensor(0.0009),KMAGA: Transcript k-mer AGA content,tensor(0.0009)
mirna_KMAGG: Transcript k-mer AGG content,tensor(-1.1474e-06),KMAGG: Transcript k-mer AGG content,tensor(-1.1474e-06)
mirna_KMAGT: Transcript k-mer AGT content,tensor(0.0025),KMAGT: Transcript k-mer AGT content,tensor(0.0025)
mirna_KMAGC: Transcript k-mer AGC content,tensor(0.0119),KMAGC: Transcript k-mer AGC content,tensor(0.0119)
mirna_KMATA: Transcript k-mer ATA content,tensor(0.0020),KMATA: Transcript k-mer ATA content,tensor(0.0020)
mirna_KMATG: Transcript k-mer ATG content,tensor(-0.0008),KMATG: Transcript k-mer ATG content,tensor(-0.0008)
mirna_KMATT: Transcript k-mer ATT content,tensor(0.0058),KMATT: Transcript k-mer ATT content,tensor(0.0058)
mirna_KMATC: Transcript k-mer ATC content,tensor(0.0030),KMATC: Transcript k-mer ATC content,tensor(0.0030)
mirna_KMACA: Transcript k-mer ACA content,tensor(0.0048),KMACA: Transcript k-mer ACA content,tensor(0.0048)
mirna_KMACG: Transcript k-mer ACG content,tensor(0.0005),KMACG: Transcript k-mer ACG content,tensor(0.0005)
mirna_KMACT: Transcript k-mer ACT content,tensor(0.0012),KMACT: Transcript k-mer ACT content,tensor(0.0012)
mirna_KMACC: Transcript k-mer ACC content,tensor(0.0006),KMACC: Transcript k-mer ACC content,tensor(0.0006)
mirna_KMGAA: Transcript k-mer GAA content,tensor(0.0053),KMGAA: Transcript k-mer GAA content,tensor(0.0053)
mirna_KMGAG: Transcript k-mer GAG content,tensor(5.6088e-05),KMGAG: Transcript k-mer GAG content,tensor(5.6088e-05)
mirna_KMGAT: Transcript k-mer GAT content,tensor(-0.0014),KMGAT: Transcript k-mer GAT content,tensor(-0.0014)
mirna_KMGAC: Transcript k-mer GAC content,tensor(0.0013),KMGAC: Transcript k-mer GAC content,tensor(0.0013)
mirna_KMGGA: Transcript k-mer GGA content,tensor(-0.0005),KMGGA: Transcript k-mer GGA content,tensor(-0.0005)
mirna_KMGGG: Transcript k-mer GGG content,tensor(-0.0008),KMGGG: Transcript k-mer GGG content,tensor(-0.0008)
mirna_KMGGT: Transcript k-mer GGT content,tensor(0.0019),KMGGT: Transcript k-mer GGT content,tensor(0.0019)
mirna_KMGGC: Transcript k-mer GGC content,tensor(0.0047),KMGGC: Transcript k-mer GGC content,tensor(0.0047)
mirna_KMGTA: Transcript k-mer GTA content,tensor(0.0017),KMGTA: Transcript k-mer GTA content,tensor(0.0017)
mirna_KMGTG: Transcript k-mer GTG content,tensor(0.0091),KMGTG: Transcript k-mer GTG content,tensor(0.0091)
mirna_KMGTT: Transcript k-mer GTT content,tensor(0.0005),KMGTT: Transcript k-mer GTT content,tensor(0.0005)
mirna_KMGTC: Transcript k-mer GTC content,tensor(-0.0019),KMGTC: Transcript k-mer GTC content,tensor(-0.0019)
mirna_KMGCA: Transcript k-mer GCA content,tensor(0.0136),KMGCA: Transcript k-mer GCA content,tensor(0.0136)
mirna_KMGCG: Transcript k-mer GCG content,tensor(0.0001),KMGCG: Transcript k-mer GCG content,tensor(0.0001)
mirna_KMGCT: Transcript k-mer GCT content,tensor(5.8144e-05),KMGCT: Transcript k-mer GCT content,tensor(5.8144e-05)
mirna_KMGCC: Transcript k-mer GCC content,tensor(0.0002),KMGCC: Transcript k-mer GCC content,tensor(0.0002)
mirna_KMTAA: Transcript k-mer TAA content,tensor(0.0082),KMTAA: Transcript k-mer TAA content,tensor(0.0082)
mirna_KMTAG: Transcript k-mer TAG content,tensor(-0.0018),KMTAG: Transcript k-mer TAG content,tensor(-0.0018)
mirna_KMTAT: Transcript k-mer TAT content,tensor(0.0022),KMTAT: Transcript k-mer TAT content,tensor(0.0022)
mirna_KMTAC: Transcript k-mer TAC content,tensor(0.0002),KMTAC: Transcript k-mer TAC content,tensor(0.0002)
mirna_KMTGA: Transcript k-mer TGA content,tensor(0.0035),KMTGA: Transcript k-mer TGA content,tensor(0.0035)
mirna_KMTGG: Transcript k-mer TGG content,tensor(0.0027),KMTGG: Transcript k-mer TGG content,tensor(0.0027)
mirna_KMTGT: Transcript k-mer TGT content,tensor(0.0064),KMTGT: Transcript k-mer TGT content,tensor(0.0064)
mirna_KMTGC: Transcript k-mer TGC content,tensor(0.0009),KMTGC: Transcript k-mer TGC content,tensor(0.0009)
mirna_KMTTA: Transcript k-mer TTA content,tensor(-4.7088e-05),KMTTA: Transcript k-mer TTA content,tensor(-4.7088e-05)
mirna_KMTTG: Transcript k-mer TTG content,tensor(0.0015),KMTTG: Transcript k-mer TTG content,tensor(0.0015)
mirna_KMTTT: Transcript k-mer TTT content,tensor(-0.0009),KMTTT: Transcript k-mer TTT content,tensor(-0.0009)
mirna_KMTTC: Transcript k-mer TTC content,tensor(-0.0017),KMTTC: Transcript k-mer TTC content,tensor(-0.0017)
mirna_KMTCA: Transcript k-mer TCA content,tensor(-0.0011),KMTCA: Transcript k-mer TCA content,tensor(-0.0011)
mirna_KMTCG: Transcript k-mer TCG content,tensor(-0.0001),KMTCG: Transcript k-mer TCG content,tensor(-0.0001)
mirna_KMTCT: Transcript k-mer TCT content,tensor(-0.0014),KMTCT: Transcript k-mer TCT content,tensor(-0.0014)
mirna_KMTCC: Transcript k-mer TCC content,tensor(-0.0018),KMTCC: Transcript k-mer TCC content,tensor(-0.0018)
mirna_KMCAA: Transcript k-mer CAA content,tensor(-0.0046),KMCAA: Transcript k-mer CAA content,tensor(-0.0046)
mirna_KMCAG: Transcript k-mer CAG content,tensor(0.0097),KMCAG: Transcript k-mer CAG content,tensor(0.0097)
mirna_KMCAT: Transcript k-mer CAT content,tensor(0.0033),KMCAT: Transcript k-mer CAT content,tensor(0.0033)
mirna_KMCAC: Transcript k-mer CAC content,tensor(-0.0005),KMCAC: Transcript k-mer CAC content,tensor(-0.0005)
mirna_KMCGA: Transcript k-mer CGA content,tensor(0.0005),KMCGA: Transcript k-mer CGA content,tensor(0.0005)
mirna_KMCGG: Transcript k-mer CGG content,tensor(0.0014),KMCGG: Transcript k-mer CGG content,tensor(0.0014)
mirna_KMCGT: Transcript k-mer CGT content,tensor(-1.8328e-05),KMCGT: Transcript k-mer CGT content,tensor(-1.8328e-05)
mirna_KMCGC: Transcript k-mer CGC content,tensor(-1.2323e-05),KMCGC: Transcript k-mer CGC content,tensor(-1.2323e-05)
mirna_KMCTA: Transcript k-mer CTA content,tensor(-0.0005),KMCTA: Transcript k-mer CTA content,tensor(-0.0005)
mirna_KMCTG: Transcript k-mer CTG content,tensor(0.0040),KMCTG: Transcript k-mer CTG content,tensor(0.0040)
mirna_KMCTT: Transcript k-mer CTT content,tensor(0.0004),KMCTT: Transcript k-mer CTT content,tensor(0.0004)
mirna_KMCTC: Transcript k-mer CTC content,tensor(-0.0018),KMCTC: Transcript k-mer CTC content,tensor(-0.0018)
mirna_KMCCA: Transcript k-mer CCA content,tensor(-0.0012),KMCCA: Transcript k-mer CCA content,tensor(-0.0012)
mirna_KMCCG: Transcript k-mer CCG content,tensor(-0.0001),KMCCG: Transcript k-mer CCG content,tensor(-0.0001)
mirna_KMCCT: Transcript k-mer CCT content,tensor(0.0016),KMCCT: Transcript k-mer CCT content,tensor(0.0016)
mirna_KMCCC: Transcript k-mer CCC content,tensor(0.0026),KMCCC: Transcript k-mer CCC content,tensor(0.0026)
mirna_EucDist.LNC,tensor(-0.0007),EucDist.LNC,tensor(-0.0007)
mirna_EucDist.PCT,tensor(-0.0013),EucDist.PCT,tensor(-0.0013)
mirna_EucDist.Ratio,tensor(0.0034),EucDist.Ratio,tensor(0.0034)
mirna_LogDist.LNC,tensor(0.0019),LogDist.LNC,tensor(0.0019)
mirna_LogDist.PCT,tensor(0.0004),LogDist.PCT,tensor(0.0004)
mirna_LogDist.Ratio,tensor(-2.4796e-05),LogDist.Ratio,tensor(-2.4796e-05)
mirna_ProII: Pseudo protein instability index,tensor(-0.0007),ProII: Pseudo protein instability index,tensor(-0.0007)
mirna_ProPI: Pseudo protein isoelectric point,tensor(1.6630e-05),ProPI: Pseudo protein isoelectric point,tensor(1.6630e-05)
mirna_ProAH: Pseudo protein average hydropathy,tensor(0.0022),ProAH: Pseudo protein average hydropathy,tensor(0.0022)
mirna_ProMW: Pseudo protein molecular weight,tensor(-0.0002),ProMW: Pseudo protein molecular weight,tensor(-0.0002)
mirna_PPMFS: Pseudo protein PI-MW frame score,tensor(0.0001),PPMFS: Pseudo protein PI-MW frame score,tensor(0.0001)
mirna_EipSP: Electron-ion interaction pseudopotential signal peak,tensor(0.0089),EipSP: Electron-ion interaction pseudopotential signal peak,tensor(0.0089)
mirna_EipAP: Electron-ion interaction pseudopotential average power,tensor(0.0033),EipAP: Electron-ion interaction pseudopotential average power,tensor(0.0033)
mirna_EiSNR: Electron-ion interaction pseudopotential signal/noise ratio,tensor(0.0059),EiSNR: Electron-ion interaction pseudopotential signal/noise ratio,tensor(0.0059)
mirna_EiPS0: Electron-ion interaction pseudopotential spectrum 0,tensor(0.0081),EiPS0: Electron-ion interaction pseudopotential spectrum 0,tensor(0.0081)
mirna_EiPS1: Electron-ion interaction pseudopotential spectrum 0.25,tensor(0.0105),EiPS1: Electron-ion interaction pseudopotential spectrum 0.25,tensor(0.0105)
mirna_EiPS2: Electron-ion interaction pseudopotential spectrum 0.5,tensor(0.0085),EiPS2: Electron-ion interaction pseudopotential spectrum 0.5,tensor(0.0085)
mirna_EiPS3: Electron-ion interaction pseudopotential spectrum 0.75,tensor(0.0069),EiPS3: Electron-ion interaction pseudopotential spectrum 0.75,tensor(0.0069)
mirna_EiPS4: Electron-ion interaction pseudopotential spectrum 1,tensor(0.0049),EiPS4: Electron-ion interaction pseudopotential spectrum 1,tensor(0.0049)
mirna_SLDLD: Structural logarithm distance to lncRNA of acguD,tensor(0.0022),SLDLD: Structural logarithm distance to lncRNA of acguD,tensor(0.0022)
mirna_SLDPD: Structural logarithm distance to pcRNA of acguD,tensor(0.0023),SLDPD: Structural logarithm distance to pcRNA of acguD,tensor(0.0023)
mirna_SLDRD: Structural logarithm distance acguD ratio,tensor(-0.0031),SLDRD: Structural logarithm distance acguD ratio,tensor(-0.0031)
mirna_SLDLN: Structural logarithm distance to lncRNA of acguACGU,tensor(3.1441e-06),SLDLN: Structural logarithm distance to lncRNA of acguACGU,tensor(3.1441e-06)
mirna_SLDPN: Structural logarithm distance to pcRNA of acguACGU,tensor(-8.9765e-05),SLDPN: Structural logarithm distance to pcRNA of acguACGU,tensor(-8.9765e-05)
mirna_SLDRN: Structural logarithm distance acguACGU ratio,tensor(-0.0035),SLDRN: Structural logarithm distance acguACGU ratio,tensor(-0.0035)
mirna_SDMFE: Secondary structural minimum free energy,tensor(-0.0005),SDMFE: Secondary structural minimum free energy,tensor(-0.0005)
mirna_SFPUS: Secondary structural UP frequency paired-unpaired,tensor(0.0027),SFPUS: Secondary structural UP frequency paired-unpaired,tensor(0.0027)
mirna_nMFE,tensor(0.0027),nMFE,tensor(0.0027)
lncrna_FickS: Fickett score,tensor(-0.0003),FickS: Fickett score,tensor(-0.0003)
lncrna_SCCou: Stop codon count,tensor(0.0010),SCCou: Stop codon count,tensor(0.0010)
lncrna_SCFre: Stop codon frequency,tensor(0.0013),SCFre: Stop codon frequency,tensor(0.0013)
lncrna_SCCFS: Stop codon count frame score,tensor(0.0006),SCCFS: Stop codon count frame score,tensor(0.0006)
lncrna_SCFFS: Stop codon frequency frame score,tensor(0.0004),SCFFS: Stop codon frequency frame score,tensor(0.0004)
lncrna_LORFL: Longest ORF length,tensor(0.0011),LORFL: Longest ORF length,tensor(0.0011)
lncrna_ORFCo: ORF coverage,tensor(-0.0024),ORFCo: ORF coverage,tensor(-0.0024)
lncrna_ORFIn: ORF integrity,tensor(0.0050),ORFIn: ORF integrity,tensor(0.0050)
lncrna_ORFFS: ORF frame score,tensor(2.1905e-05),ORFFS: ORF frame score,tensor(2.1905e-05)
lncrna_ORFEA: Entropy density A on ORF,tensor(-0.0004),ORFEA: Entropy density A on ORF,tensor(-0.0004)
lncrna_ORFEC: Entropy density C on ORF,tensor(0.0034),ORFEC: Entropy density C on ORF,tensor(0.0034)
lncrna_ORFED: Entropy density D on ORF,tensor(0.0035),ORFED: Entropy density D on ORF,tensor(0.0035)
lncrna_ORFEE: Entropy density E on ORF,tensor(0.0019),ORFEE: Entropy density E on ORF,tensor(0.0019)
lncrna_ORFEF: Entropy density F on ORF,tensor(0.0028),ORFEF: Entropy density F on ORF,tensor(0.0028)
lncrna_ORFEG: Entropy density G on ORF,tensor(0.0018),ORFEG: Entropy density G on ORF,tensor(0.0018)
lncrna_ORFEH: Entropy density H on ORF,tensor(0.0020),ORFEH: Entropy density H on ORF,tensor(0.0020)
lncrna_ORFEI: Entropy density I on ORF,tensor(0.0019),ORFEI: Entropy density I on ORF,tensor(0.0019)
lncrna_ORFEK: Entropy density K on ORF,tensor(0.0014),ORFEK: Entropy density K on ORF,tensor(0.0014)
lncrna_ORFEL: Entropy density L on ORF,tensor(0.0031),ORFEL: Entropy density L on ORF,tensor(0.0031)
lncrna_ORFEM: Entropy density M on ORF,tensor(0.0002),ORFEM: Entropy density M on ORF,tensor(0.0002)
lncrna_ORFEN: Entropy density N on ORF,tensor(0.0058),ORFEN: Entropy density N on ORF,tensor(0.0058)
lncrna_ORFEP: Entropy density P on ORF,tensor(0.0068),ORFEP: Entropy density P on ORF,tensor(0.0068)
lncrna_ORFEQ: Entropy density Q on ORF,tensor(-0.0019),ORFEQ: Entropy density Q on ORF,tensor(-0.0019)
lncrna_ORFER: Entropy density R on ORF,tensor(0.0025),ORFER: Entropy density R on ORF,tensor(0.0025)
lncrna_ORFES: Entropy density S on ORF,tensor(0.0019),ORFES: Entropy density S on ORF,tensor(0.0019)
lncrna_ORFET: Entropy density T on ORF,tensor(-0.0009),ORFET: Entropy density T on ORF,tensor(-0.0009)
lncrna_ORFEV: Entropy density V on ORF,tensor(0.0015),ORFEV: Entropy density V on ORF,tensor(0.0015)
lncrna_ORFEW: Entropy density W on ORF,tensor(-0.0003),ORFEW: Entropy density W on ORF,tensor(-0.0003)
lncrna_ORFEY: Entropy density Y on ORF,tensor(0.0010),ORFEY: Entropy density Y on ORF,tensor(0.0010)
lncrna_EucDist.LNC_orf,tensor(0.0009),EucDist.LNC_orf,tensor(0.0009)
lncrna_EucDist.PCT_orf,tensor(0.0008),EucDist.PCT_orf,tensor(0.0008)
lncrna_EucDist.Ratio_orf,tensor(0.0018),EucDist.Ratio_orf,tensor(0.0018)
lncrna_LogDist.LNC_orf,tensor(-0.0002),LogDist.LNC_orf,tensor(-0.0002)
lncrna_LogDist.PCT_orf,tensor(0.0009),LogDist.PCT_orf,tensor(0.0009)
lncrna_LogDist.Ratio_orf,tensor(0.0004),LogDist.Ratio_orf,tensor(0.0004)
lncrna_Hexamer.Score_orf,tensor(-3.9041e-06),Hexamer.Score_orf,tensor(-3.9041e-06)
lncrna_GCCoW: GC content of whole sequence,tensor(-0.0003),GCCoW: GC content of whole sequence,tensor(-0.0003)
lncrna_GCCo1: GC content of 1st position of codons,tensor(0.0015),GCCo1: GC content of 1st position of codons,tensor(0.0015)
lncrna_GCCo2: GC content of 2nd position of codons,tensor(0.0013),GCCo2: GC content of 2nd position of codons,tensor(0.0013)
lncrna_GCCo3: GC content of 3rd position of codons,tensor(-0.0007),GCCo3: GC content of 3rd position of codons,tensor(-0.0007)
lncrna_GCC1V: GCCo1 variance frame score,tensor(-0.0008),GCC1V: GCCo1 variance frame score,tensor(-0.0008)
lncrna_GCC2V: GCCo2 variance frame score,tensor(-0.0007),GCC2V: GCCo2 variance frame score,tensor(-0.0007)
lncrna_GCC3V: GCCo3 variance frame score,tensor(-0.0006),GCC3V: GCCo3 variance frame score,tensor(-0.0006)
lncrna_TraHS: Hexamer score on transcript,tensor(-3.9041e-06),TraHS: Hexamer score on transcript,tensor(-3.9041e-06)
lncrna_TrLen: Transcript length,tensor(0.0005),TrLen: Transcript length,tensor(0.0005)
lncrna_L5UTR: Length of 5 untranslated region,tensor(0.0007),L5UTR: Length of 5 untranslated region,tensor(0.0007)
lncrna_L3UTR: Length of 3 untranslated region,tensor(0.0011),L3UTR: Length of 3 untranslated region,tensor(0.0011)
lncrna_C5UTR: Coverage of 5 untranslated region,tensor(0.0034),C5UTR: Coverage of 5 untranslated region,tensor(0.0034)
lncrna_C3UTR: Coverage of 3 untranslated region,tensor(0.0085),C3UTR: Coverage of 3 untranslated region,tensor(0.0085)
lncrna_TraEA: Entropy density A on transcript,tensor(0.0012),TraEA: Entropy density A on transcript,tensor(0.0012)
lncrna_TraEC: Entropy density C on transcript,tensor(0.0017),TraEC: Entropy density C on transcript,tensor(0.0017)
lncrna_TraED: Entropy density D on transcript,tensor(-0.0007),TraED: Entropy density D on transcript,tensor(-0.0007)
lncrna_TraEE: Entropy density E on transcript,tensor(-4.9829e-05),TraEE: Entropy density E on transcript,tensor(-4.9829e-05)
lncrna_TraEF: Entropy density F on transcript,tensor(0.0053),TraEF: Entropy density F on transcript,tensor(0.0053)
