,0,1,2
lncrna_TraEG: Entropy density G on transcript,tensor(0.0019),TraEG: Entropy density G on transcript,tensor(0.0019)
lncrna_TraEH: Entropy density H on transcript,tensor(0.0047),TraEH: Entropy density H on transcript,tensor(0.0047)
lncrna_TraEI: Entropy density I on transcript,tensor(0.0050),TraEI: Entropy density I on transcript,tensor(0.0050)
lncrna_TraEK: Entropy density K on transcript,tensor(0.0002),TraEK: Entropy density K on transcript,tensor(0.0002)
lncrna_TraEL: Entropy density L on transcript,tensor(0.0015),TraEL: Entropy density L on transcript,tensor(0.0015)
lncrna_TraEM: Entropy density M on transcript,tensor(0.0008),TraEM: Entropy density M on transcript,tensor(0.0008)
lncrna_TraEN: Entropy density N on transcript,tensor(0.0028),TraEN: Entropy density N on transcript,tensor(0.0028)
lncrna_TraEP: Entropy density P on transcript,tensor(0.0038),TraEP: Entropy density P on transcript,tensor(0.0038)
lncrna_TraEQ: Entropy density Q on transcript,tensor(0.0010),TraEQ: Entropy density Q on transcript,tensor(0.0010)
lncrna_TraER: Entropy density R on transcript,tensor(0.0041),TraER: Entropy density R on transcript,tensor(0.0041)
lncrna_TraES: Entropy density S on transcript,tensor(-0.0003),TraES: Entropy density S on transcript,tensor(-0.0003)
lncrna_TraET: Entropy density T on transcript,tensor(0.0062),TraET: Entropy density T on transcript,tensor(0.0062)
lncrna_TraEV: Entropy density V on transcript,tensor(0.0013),TraEV: Entropy density V on transcript,tensor(0.0013)
lncrna_TraEW: Entropy density W on transcript,tensor(-0.0027),TraEW: Entropy density W on transcript,tensor(-0.0027)
lncrna_TraEY: Entropy density Y on transcript,tensor(0.0052),TraEY: Entropy density Y on transcript,tensor(0.0052)
lncrna_ComRA: Composition of A,tensor(0.0008),ComRA: Composition of A,tensor(0.0008)
lncrna_ComRT: Composition of T,tensor(0.0039),ComRT: Composition of T,tensor(0.0039)
lncrna_ComRG: Composition of G,tensor(-0.0005),ComRG: Composition of G,tensor(-0.0005)
lncrna_ComRC: Composition of C,tensor(0.0033),ComRC: Composition of C,tensor(0.0033)
lncrna_TraAT: Transition between A and T,tensor(0.0028),TraAT: Transition between A and T,tensor(0.0028)
lncrna_TraAG: Transition between A and G,tensor(-8.8602e-05),TraAG: Transition between A and G,tensor(-8.8602e-05)
lncrna_TraAC: Transition between A and C,tensor(0.0030),TraAC: Transition between A and C,tensor(0.0030)
lncrna_TraTG: Transition between T and G,tensor(0.0018),TraTG: Transition between T and G,tensor(0.0018)
lncrna_TraTC: Transition between T and C,tensor(0.0055),TraTC: Transition between T and C,tensor(0.0055)
lncrna_TraGC: Transition between G and C,tensor(0.0012),TraGC: Transition between G and C,tensor(0.0012)
lncrna_DPRA0: Distribution of 0.00A,tensor(-0.0005),DPRA0: Distribution of 0.00A,tensor(-0.0005)
lncrna_DPRA1: Distribution of 0.25A,tensor(-2.6003e-05),DPRA1: Distribution of 0.25A,tensor(-2.6003e-05)
lncrna_DPRA2: Distribution of 0.50A,tensor(-0.0003),DPRA2: Distribution of 0.50A,tensor(-0.0003)
lncrna_DPRA3: Distribution of 0.75A,tensor(0.0018),DPRA3: Distribution of 0.75A,tensor(0.0018)
lncrna_DPRA4: Distribution of 1.00A,tensor(-0.0002),DPRA4: Distribution of 1.00A,tensor(-0.0002)
lncrna_DPRT0: Distribution of 0.00T,tensor(-0.0005),DPRT0: Distribution of 0.00T,tensor(-0.0005)
lncrna_DPRT1: Distribution of 0.25T,tensor(-0.0003),DPRT1: Distribution of 0.25T,tensor(-0.0003)
lncrna_DPRT2: Distribution of 0.50T,tensor(0.0014),DPRT2: Distribution of 0.50T,tensor(0.0014)
lncrna_DPRT3: Distribution of 0.75T,tensor(-0.0003),DPRT3: Distribution of 0.75T,tensor(-0.0003)
lncrna_DPRT4: Distribution of 1.00T,tensor(0.0026),DPRT4: Distribution of 1.00T,tensor(0.0026)
lncrna_DPRG0: Distribution of 0.00G,tensor(-0.0010),DPRG0: Distribution of 0.00G,tensor(-0.0010)
lncrna_DPRG1: Distribution of 0.25G,tensor(0.0041),DPRG1: Distribution of 0.25G,tensor(0.0041)
lncrna_DPRG2: Distribution of 0.50G,tensor(0.0027),DPRG2: Distribution of 0.50G,tensor(0.0027)
lncrna_DPRG3: Distribution of 0.75G,tensor(0.0004),DPRG3: Distribution of 0.75G,tensor(0.0004)
lncrna_DPRG4: Distribution of 1.00G,tensor(0.0021),DPRG4: Distribution of 1.00G,tensor(0.0021)
lncrna_DPRC0: Distribution of 0.00C,tensor(-0.0008),DPRC0: Distribution of 0.00C,tensor(-0.0008)
lncrna_DPRC1: Distribution of 0.25C,tensor(0.0006),DPRC1: Distribution of 0.25C,tensor(0.0006)
lncrna_DPRC2: Distribution of 0.50C,tensor(-0.0008),DPRC2: Distribution of 0.50C,tensor(-0.0008)
lncrna_DPRC3: Distribution of 0.75C,tensor(-0.0023),DPRC3: Distribution of 0.75C,tensor(-0.0023)
lncrna_DPRC4: Distribution of 1.00C,tensor(0.0013),DPRC4: Distribution of 1.00C,tensor(0.0013)
lncrna_KMAAA: Transcript k-mer AAA content,tensor(0.0026),KMAAA: Transcript k-mer AAA content,tensor(0.0026)
lncrna_KMAAG: Transcript k-mer AAG content,tensor(-0.0010),KMAAG: Transcript k-mer AAG content,tensor(-0.0010)
lncrna_KMAAT: Transcript k-mer AAT content,tensor(0.0041),KMAAT: Transcript k-mer AAT content,tensor(0.0041)
lncrna_KMAAC: Transcript k-mer AAC content,tensor(0.0019),KMAAC: Transcript k-mer AAC content,tensor(0.0019)
lncrna_KMAGA: Transcript k-mer AGA content,tensor(0.0031),KMAGA: Transcript k-mer AGA content,tensor(0.0031)
lncrna_KMAGG: Transcript k-mer AGG content,tensor(-0.0002),KMAGG: Transcript k-mer AGG content,tensor(-0.0002)
lncrna_KMAGT: Transcript k-mer AGT content,tensor(0.0029),KMAGT: Transcript k-mer AGT content,tensor(0.0029)
lncrna_KMAGC: Transcript k-mer AGC content,tensor(-0.0004),KMAGC: Transcript k-mer AGC content,tensor(-0.0004)
lncrna_KMATA: Transcript k-mer ATA content,tensor(0.0034),KMATA: Transcript k-mer ATA content,tensor(0.0034)
lncrna_KMATG: Transcript k-mer ATG content,tensor(-0.0004),KMATG: Transcript k-mer ATG content,tensor(-0.0004)
lncrna_KMATT: Transcript k-mer ATT content,tensor(0.0047),KMATT: Transcript k-mer ATT content,tensor(0.0047)
lncrna_KMATC: Transcript k-mer ATC content,tensor(0.0016),KMATC: Transcript k-mer ATC content,tensor(0.0016)
lncrna_KMACA: Transcript k-mer ACA content,tensor(0.0033),KMACA: Transcript k-mer ACA content,tensor(0.0033)
lncrna_KMACG: Transcript k-mer ACG content,tensor(0.0023),KMACG: Transcript k-mer ACG content,tensor(0.0023)
lncrna_KMACT: Transcript k-mer ACT content,tensor(0.0024),KMACT: Transcript k-mer ACT content,tensor(0.0024)
lncrna_KMACC: Transcript k-mer ACC content,tensor(0.0006),KMACC: Transcript k-mer ACC content,tensor(0.0006)
lncrna_KMGAA: Transcript k-mer GAA content,tensor(0.0029),KMGAA: Transcript k-mer GAA content,tensor(0.0029)
lncrna_KMGAG: Transcript k-mer GAG content,tensor(0.0001),KMGAG: Transcript k-mer GAG content,tensor(0.0001)
lncrna_KMGAT: Transcript k-mer GAT content,tensor(0.0008),KMGAT: Transcript k-mer GAT content,tensor(0.0008)
lncrna_KMGAC: Transcript k-mer GAC content,tensor(0.0099),KMGAC: Transcript k-mer GAC content,tensor(0.0099)
lncrna_KMGGA: Transcript k-mer GGA content,tensor(-0.0017),KMGGA: Transcript k-mer GGA content,tensor(-0.0017)
lncrna_KMGGG: Transcript k-mer GGG content,tensor(0.0020),KMGGG: Transcript k-mer GGG content,tensor(0.0020)
lncrna_KMGGT: Transcript k-mer GGT content,tensor(0.0003),KMGGT: Transcript k-mer GGT content,tensor(0.0003)
lncrna_KMGGC: Transcript k-mer GGC content,tensor(0.0011),KMGGC: Transcript k-mer GGC content,tensor(0.0011)
lncrna_KMGTA: Transcript k-mer GTA content,tensor(0.0027),KMGTA: Transcript k-mer GTA content,tensor(0.0027)
lncrna_KMGTG: Transcript k-mer GTG content,tensor(0.0052),KMGTG: Transcript k-mer GTG content,tensor(0.0052)
lncrna_KMGTT: Transcript k-mer GTT content,tensor(0.0080),KMGTT: Transcript k-mer GTT content,tensor(0.0080)
lncrna_KMGTC: Transcript k-mer GTC content,tensor(-0.0008),KMGTC: Transcript k-mer GTC content,tensor(-0.0008)
lncrna_KMGCA: Transcript k-mer GCA content,tensor(0.0047),KMGCA: Transcript k-mer GCA content,tensor(0.0047)
lncrna_KMGCG: Transcript k-mer GCG content,tensor(0.0024),KMGCG: Transcript k-mer GCG content,tensor(0.0024)
lncrna_KMGCT: Transcript k-mer GCT content,tensor(-0.0026),KMGCT: Transcript k-mer GCT content,tensor(-0.0026)
lncrna_KMGCC: Transcript k-mer GCC content,tensor(0.0009),KMGCC: Transcript k-mer GCC content,tensor(0.0009)
lncrna_KMTAA: Transcript k-mer TAA content,tensor(0.0025),KMTAA: Transcript k-mer TAA content,tensor(0.0025)
lncrna_KMTAG: Transcript k-mer TAG content,tensor(0.0064),KMTAG: Transcript k-mer TAG content,tensor(0.0064)
lncrna_KMTAT: Transcript k-mer TAT content,tensor(0.0014),KMTAT: Transcript k-mer TAT content,tensor(0.0014)
lncrna_KMTAC: Transcript k-mer TAC content,tensor(0.0030),KMTAC: Transcript k-mer TAC content,tensor(0.0030)
lncrna_KMTGA: Transcript k-mer TGA content,tensor(0.0041),KMTGA: Transcript k-mer TGA content,tensor(0.0041)
lncrna_KMTGG: Transcript k-mer TGG content,tensor(-0.0005),KMTGG: Transcript k-mer TGG content,tensor(-0.0005)
lncrna_KMTGT: Transcript k-mer TGT content,tensor(0.0021),KMTGT: Transcript k-mer TGT content,tensor(0.0021)
lncrna_KMTGC: Transcript k-mer TGC content,tensor(0.0006),KMTGC: Transcript k-mer TGC content,tensor(0.0006)
lncrna_KMTTA: Transcript k-mer TTA content,tensor(0.0024),KMTTA: Transcript k-mer TTA content,tensor(0.0024)
lncrna_KMTTG: Transcript k-mer TTG content,tensor(0.0048),KMTTG: Transcript k-mer TTG content,tensor(0.0048)
lncrna_KMTTT: Transcript k-mer TTT content,tensor(0.0062),KMTTT: Transcript k-mer TTT content,tensor(0.0062)
lncrna_KMTTC: Transcript k-mer TTC content,tensor(0.0175),KMTTC: Transcript k-mer TTC content,tensor(0.0175)
lncrna_KMTCA: Transcript k-mer TCA content,tensor(0.0057),KMTCA: Transcript k-mer TCA content,tensor(0.0057)
lncrna_KMTCG: Transcript k-mer TCG content,tensor(0.0034),KMTCG: Transcript k-mer TCG content,tensor(0.0034)
lncrna_KMTCT: Transcript k-mer TCT content,tensor(0.0041),KMTCT: Transcript k-mer TCT content,tensor(0.0041)
lncrna_KMTCC: Transcript k-mer TCC content,tensor(0.0052),KMTCC: Transcript k-mer TCC content,tensor(0.0052)
lncrna_KMCAA: Transcript k-mer CAA content,tensor(-0.0012),KMCAA: Transcript k-mer CAA content,tensor(-0.0012)
lncrna_KMCAG: Transcript k-mer CAG content,tensor(0.0021),KMCAG: Transcript k-mer CAG content,tensor(0.0021)
lncrna_KMCAT: Transcript k-mer CAT content,tensor(0.0047),KMCAT: Transcript k-mer CAT content,tensor(0.0047)
lncrna_KMCAC: Transcript k-mer CAC content,tensor(0.0043),KMCAC: Transcript k-mer CAC content,tensor(0.0043)
lncrna_KMCGA: Transcript k-mer CGA content,tensor(0.0066),KMCGA: Transcript k-mer CGA content,tensor(0.0066)
lncrna_KMCGG: Transcript k-mer CGG content,tensor(0.0020),KMCGG: Transcript k-mer CGG content,tensor(0.0020)
lncrna_KMCGT: Transcript k-mer CGT content,tensor(0.0060),KMCGT: Transcript k-mer CGT content,tensor(0.0060)
lncrna_KMCGC: Transcript k-mer CGC content,tensor(0.0021),KMCGC: Transcript k-mer CGC content,tensor(0.0021)
lncrna_KMCTA: Transcript k-mer CTA content,tensor(0.0008),KMCTA: Transcript k-mer CTA content,tensor(0.0008)
lncrna_KMCTG: Transcript k-mer CTG content,tensor(0.0034),KMCTG: Transcript k-mer CTG content,tensor(0.0034)
lncrna_KMCTT: Transcript k-mer CTT content,tensor(0.0051),KMCTT: Transcript k-mer CTT content,tensor(0.0051)
lncrna_KMCTC: Transcript k-mer CTC content,tensor(0.0025),KMCTC: Transcript k-mer CTC content,tensor(0.0025)
lncrna_KMCCA: Transcript k-mer CCA content,tensor(0.0003),KMCCA: Transcript k-mer CCA content,tensor(0.0003)
lncrna_KMCCG: Transcript k-mer CCG content,tensor(0.0014),KMCCG: Transcript k-mer CCG content,tensor(0.0014)
lncrna_KMCCT: Transcript k-mer CCT content,tensor(0.0037),KMCCT: Transcript k-mer CCT content,tensor(0.0037)
lncrna_KMCCC: Transcript k-mer CCC content,tensor(0.0044),KMCCC: Transcript k-mer CCC content,tensor(0.0044)
lncrna_EucDist.LNC,tensor(-0.0027),EucDist.LNC,tensor(-0.0027)
lncrna_EucDist.PCT,tensor(-0.0029),EucDist.PCT,tensor(-0.0029)
lncrna_EucDist.Ratio,tensor(-0.0006),EucDist.Ratio,tensor(-0.0006)
lncrna_LogDist.LNC,tensor(0.0018),LogDist.LNC,tensor(0.0018)
lncrna_LogDist.PCT,tensor(0.0013),LogDist.PCT,tensor(0.0013)
lncrna_LogDist.Ratio,tensor(0.0017),LogDist.Ratio,tensor(0.0017)
lncrna_ProII: Pseudo protein instability index,tensor(0.0072),ProII: Pseudo protein instability index,tensor(0.0072)
lncrna_ProPI: Pseudo protein isoelectric point,tensor(0.0009),ProPI: Pseudo protein isoelectric point,tensor(0.0009)
lncrna_ProAH: Pseudo protein average hydropathy,tensor(0.0012),ProAH: Pseudo protein average hydropathy,tensor(0.0012)
lncrna_ProMW: Pseudo protein molecular weight,tensor(0.0015),ProMW: Pseudo protein molecular weight,tensor(0.0015)
lncrna_PPMFS: Pseudo protein PI-MW frame score,tensor(0.0042),PPMFS: Pseudo protein PI-MW frame score,tensor(0.0042)
lncrna_EipSP: Electron-ion interaction pseudopotential signal peak,tensor(0.0003),EipSP: Electron-ion interaction pseudopotential signal peak,tensor(0.0003)
lncrna_EipAP: Electron-ion interaction pseudopotential average power,tensor(0.0003),EipAP: Electron-ion interaction pseudopotential average power,tensor(0.0003)
lncrna_EiSNR: Electron-ion interaction pseudopotential signal/noise ratio,tensor(-0.0001),EiSNR: Electron-ion interaction pseudopotential signal/noise ratio,tensor(-0.0001)
lncrna_EiPS0: Electron-ion interaction pseudopotential spectrum 0,tensor(0.0007),EiPS0: Electron-ion interaction pseudopotential spectrum 0,tensor(0.0007)
lncrna_EiPS1: Electron-ion interaction pseudopotential spectrum 0.25,tensor(0.0007),EiPS1: Electron-ion interaction pseudopotential spectrum 0.25,tensor(0.0007)
lncrna_EiPS2: Electron-ion interaction pseudopotential spectrum 0.5,tensor(0.0008),EiPS2: Electron-ion interaction pseudopotential spectrum 0.5,tensor(0.0008)
lncrna_EiPS3: Electron-ion interaction pseudopotential spectrum 0.75,tensor(0.0008),EiPS3: Electron-ion interaction pseudopotential spectrum 0.75,tensor(0.0008)
lncrna_EiPS4: Electron-ion interaction pseudopotential spectrum 1,tensor(0.0001),EiPS4: Electron-ion interaction pseudopotential spectrum 1,tensor(0.0001)
lncrna_SLDLD: Structural logarithm distance to lncRNA of acguD,tensor(0.0012),SLDLD: Structural logarithm distance to lncRNA of acguD,tensor(0.0012)
lncrna_SLDPD: Structural logarithm distance to pcRNA of acguD,tensor(0.0006),SLDPD: Structural logarithm distance to pcRNA of acguD,tensor(0.0006)
lncrna_SLDRD: Structural logarithm distance acguD ratio,tensor(0.0007),SLDRD: Structural logarithm distance acguD ratio,tensor(0.0007)
lncrna_SLDLN: Structural logarithm distance to lncRNA of acguACGU,tensor(0.0047),SLDLN: Structural logarithm distance to lncRNA of acguACGU,tensor(0.0047)
lncrna_SLDPN: Structural logarithm distance to pcRNA of acguACGU,tensor(0.0033),SLDPN: Structural logarithm distance to pcRNA of acguACGU,tensor(0.0033)
lncrna_SLDRN: Structural logarithm distance acguACGU ratio,tensor(0.0001),SLDRN: Structural logarithm distance acguACGU ratio,tensor(0.0001)
lncrna_SDMFE: Secondary structural minimum free energy,tensor(-0.0012),SDMFE: Secondary structural minimum free energy,tensor(-0.0012)
lncrna_SFPUS: Secondary structural UP frequency paired-unpaired,tensor(-0.0010),SFPUS: Secondary structural UP frequency paired-unpaired,tensor(-0.0010)
lncrna_nMFE,tensor(0.0031),nMFE,tensor(0.0031)
